{
  "$schema": "https://json-schema.org/draft/2020-12/schema",
  "$id": "https://runtime-profiler.local/schemas/scenario.schema.json",
  "title": "runtime-profiler scenario v1",
  "type": "object",
  "additionalProperties": false,
  "required": ["schema_version", "id", "target"],
  "properties": {
    "schema_version": { "const": "runtime-profiler/scenario/v1" },
    "id": {
      "type": "string",
      "minLength": 1,
      "maxLength": 128,
      "pattern": "^[A-Za-z0-9._-]+$"
    },
    "target": {
      "oneOf": [
        { "$ref": "#/$defs/commandTarget" },
        { "$ref": "#/$defs/browserJourneyTarget" },
        { "$ref": "#/$defs/httpWorkloadTarget" }
      ]
    },
    "run": { "$ref": "#/$defs/run" },
    "collectors": {
      "type": "array",
      "minItems": 1,
      "items": { "enum": ["process", "native-perf", "browser-chromium", "http-curl"] },
      "default": ["process"]
    }
  },
  "allOf": [
    {
      "if": {
        "properties": {
          "collectors": { "contains": { "const": "native-perf" } }
        },
        "required": ["collectors"]
      },
      "then": {
        "properties": {
          "collectors": { "contains": { "const": "process" } }
        }
      }
    },
    {
      "if": {
        "properties": {
          "target": {
            "properties": { "type": { "const": "browser-journey" } },
            "required": ["type"]
          }
        }
      },
      "then": {
        "required": ["collectors", "run"],
        "properties": {
          "collectors": { "const": ["browser-chromium"] },
          "run": {
            "allOf": [
              { "$ref": "#/$defs/run" },
              {
                "required": ["warmup_iterations", "measurement_iterations"],
                "properties": {
                  "warmup_iterations": { "const": 0 },
                  "measurement_iterations": { "const": 1 }
                }
              }
            ]
          }
        }
      },
      "else": {
        "properties": {
          "collectors": {
            "type": "array",
            "items": { "enum": ["process", "native-perf", "http-curl"] }
          }
        }
      }
    },
    {
      "if": {
        "properties": {
          "target": {
            "properties": {
              "type": {
                "const": "http-workload"
              }
            },
            "required": [
              "type"
            ]
          }
        },
        "required": [
          "target"
        ]
      },
      "then": {
        "required": [
          "collectors"
        ],
        "properties": {
          "collectors": {
            "const": [
              "http-curl"
            ]
          },
          "run": {
            "allOf": [
              {
                "$ref": "#/$defs/run"
              },
              {
                "properties": {
                  "warmup_iterations": {
                    "maximum": 3
                  },
                  "measurement_iterations": {
                    "maximum": 10
                  },
                  "timeout_seconds": {
                    "maximum": 60
                  }
                }
              }
            ]
          }
        }
      },
      "else": {
        "properties": {
          "collectors": {
            "items": {
              "not": {
                "const": "http-curl"
              }
            }
          }
        }
      }
    }
  ],
  "$defs": {
    "commandTarget": {
      "type": "object",
      "additionalProperties": false,
      "required": ["type", "program"],
      "properties": {
        "type": { "const": "command" },
        "program": { "type": "string", "minLength": 1 },
        "args": {
          "type": "array",
          "items": { "type": "string" },
          "default": []
        },
        "working_directory": { "type": ["string", "null"] },
        "inherit_env": {
          "type": "array",
          "items": { "type": "string", "minLength": 1 },
          "default": []
        }
      }
    },
    "browserJourneyTarget": {
      "type": "object",
      "additionalProperties": false,
      "required": ["type", "module"],
      "properties": {
        "type": { "const": "browser-journey" },
        "module": {
          "type": "string",
          "minLength": 1,
          "pattern": "^(?!/)(?!.*(?:^|/)\\.\\.(?:/|$)).+$"
        },
        "working_directory": { "type": ["string", "null"] },
        "inherit_env": {
          "type": "array",
          "items": { "type": "string", "minLength": 1 },
          "default": []
        }
      }
    },
    "fixtureCommand": {
      "type": "object",
      "additionalProperties": false,
      "required": [
        "program"
      ],
      "properties": {
        "program": {
          "type": "string",
          "minLength": 1,
          "maxLength": 4096
        },
        "args": {
          "type": "array",
          "maxItems": 128,
          "items": {
            "type": "string",
            "maxLength": 65536
          },
          "default": []
        }
      }
    },
    "httpFixture": {
      "type": "object",
      "additionalProperties": false,
      "required": [
        "program",
        "health_path",
        "startup_timeout_seconds"
      ],
      "properties": {
        "program": {
          "type": "string",
          "minLength": 1,
          "maxLength": 4096
        },
        "args": {
          "type": "array",
          "maxItems": 128,
          "items": {
            "type": "string",
            "maxLength": 65536
          },
          "default": []
        },
        "working_directory": {
          "type": [
            "string",
            "null"
          ]
        },
        "inherit_env": {
          "type": "array",
          "items": {
            "type": "string",
            "minLength": 1
          },
          "default": []
        },
        "health_path": {
          "type": "string",
          "minLength": 1,
          "maxLength": 2048,
          "pattern": "^/(?!/)(?!.*[#\\\\])[!-~]*$"
        },
        "startup_timeout_seconds": {
          "type": "integer",
          "minimum": 1,
          "maximum": 60
        },
        "teardown": {
          "oneOf": [
            {
              "type": "null"
            },
            {
              "$ref": "#/$defs/fixtureCommand"
            }
          ]
        }
      }
    },
    "httpRequest": {
      "type": "object",
      "additionalProperties": false,
      "required": [
        "method",
        "path",
        "expected_status"
      ],
      "properties": {
        "method": {
          "enum": [
            "GET",
            "HEAD",
            "POST",
            "PUT",
            "PATCH",
            "DELETE"
          ]
        },
        "path": {
          "type": "string",
          "minLength": 1,
          "maxLength": 2048,
          "pattern": "^/(?!/)(?!.*[#\\\\])[!-~]*$"
        },
        "body": {
          "type": [
            "string",
            "null"
          ],
          "maxLength": 65536
        },
        "content_type": { "type": ["string", "null"], "minLength": 3, "maxLength": 128, "pattern": "^[ -~]+$" },
        "expected_status": {
          "type": "integer",
          "minimum": 100,
          "maximum": 599
        }
      }
    },
    "httpWorkloadTarget": {
      "type": "object",
      "additionalProperties": false,
      "required": [
        "type",
        "fixture",
        "requests",
        "request_count",
        "concurrency",
        "request_timeout_seconds"
      ],
      "properties": {
        "type": {
          "const": "http-workload"
        },
        "fixture": {
          "$ref": "#/$defs/httpFixture"
        },
        "requests": {
          "type": "array",
          "minItems": 1,
          "maxItems": 32,
          "items": {
            "$ref": "#/$defs/httpRequest"
          }
        },
        "request_count": {
          "type": "integer",
          "minimum": 1,
          "maximum": 1000
        },
        "concurrency": {
          "type": "integer",
          "minimum": 1,
          "maximum": 32
        },
        "request_timeout_seconds": {
          "type": "integer",
          "minimum": 1,
          "maximum": 30
        }
      }
    },
    "run": {
      "type": "object",
      "additionalProperties": false,
      "properties": {
        "warmup_iterations": {
          "type": "integer",
          "minimum": 0,
          "maximum": 100,
          "default": 1
        },
        "measurement_iterations": {
          "type": "integer",
          "minimum": 1,
          "maximum": 10000,
          "default": 5
        },
        "timeout_seconds": {
          "type": "integer",
          "minimum": 1,
          "maximum": 86400,
          "default": 30
        }
      }
    }
  }
}
