{
  "schema_version": "runtime-profiler/scenario/v1",
  "id": "history-score-fixture",
  "target": {
    "type": "command",
    "program": "sh",
    "args": [
      "-c",
      "printf fixture"
    ],
    "working_directory": null,
    "inherit_env": []
  },
  "run": {
    "warmup_iterations": 1,
    "measurement_iterations": 5,
    "timeout_seconds": 30
  },
  "collectors": [
    "process"
  ]
}
